{
  "schemaVersion": 2,
  "appVersion": "0.6.0-alpha",
  "project": {
    "name": "Forge Studio Performance Scene",
    "createdAt": "2026-07-30T00:00:00.000Z",
    "updatedAt": "2026-07-30T00:00:00.000Z"
  },
  "settings": {
    "units": "meter",
    "upAxis": "Y",
    "assetFront": "+Z",
    "gridSize": 1,
    "backgroundColor": "#1B1D22"
  },
  "scene": {
    "objects": [
      {
        "id": "60000000-0000-4000-8000-000000000001",
        "type": "mesh",
        "name": "Performance Mesh 1",
        "parentId": null,
        "visible": true,
        "locked": false,
        "transform": {
          "position": [-11.875, 0.5, -5.625],
          "rotation": {
            "order": "XYZ",
            "radians": [0, 0, 0]
          },
          "scale": [1, 1, 1]
        },
        "editor": {
          "templateRole": "none"
        },
        "geometry": {
          "kind": "sphere",
          "parameters": {
            "radius": 0.45,
            "widthSegments": 25,
            "heightSegments": 11
          }
        },
        "material": {
          "type": "meshStandard",
          "color": "#C73333",
          "roughness": 0.55,
          "metalness": 0.05,
          "opacity": 1,
          "transparent": false,
          "wireframe": false,
          "flatShading": false,
          "side": "front"
        }
      },
      {
        "id": "60000000-0000-4000-8000-000000000002",
        "type": "mesh",
        "name": "Performance Mesh 2",
        "parentId": null,
        "visible": true,
        "locked": false,
        "transform": {
          "position": [-10.625, 0.5, -5.625],
          "rotation": {
            "order": "XYZ",
            "radians": [0, 0, 0]
          },
          "scale": [1, 1, 1]
        },
        "editor": {
          "templateRole": "none"
        },
        "geometry": {
          "kind": "sphere",
          "parameters": {
            "radius": 0.45,
            "widthSegments": 25,
            "heightSegments": 11
          }
        },
        "material": {
          "type": "meshStandard",
          "color": "#33C75E",
          "roughness": 0.55,
          "metalness": 0.05,
          "opacity": 1,
          "transparent": false,
          "wireframe": false,
          "flatShading": false,
          "side": "front"
        }
      },
      {
        "id": "60000000-0000-4000-8000-000000000003",
        "type": "mesh",
        "name": "Performance Mesh 3",
        "parentId": null,
        "visible": true,
        "locked": false,
        "transform": {
          "position": [-9.375, 0.5, -5.625],
          "rotation": {
            "order": "XYZ",
            "radians": [0, 0, 0]
          },
          "scale": [1, 1, 1]
        },
        "editor": {
          "templateRole": "none"
        },
        "geometry": {
          "kind": "sphere",
          "parameters": {
            "radius": 0.45,
            "widthSegments": 25,
            "heightSegments": 11
          }
        },
        "material": {
          "type": "meshStandard",
          "color": "#8933C7",
          "roughness": 0.55,
          "metalness": 0.05,
          "opacity": 1,
          "transparent": false,
          "wireframe": false,
          "flatShading": false,
          "side": "front"
        }
      },
      {
        "id": "60000000-0000-4000-8000-000000000004",
        "type": "mesh",
        "name": "Performance Mesh 4",
        "parentId": null,
        "visible": true,
        "locked": false,
        "transform": {
          "position": [-8.125, 0.5, -5.625],
          "rotation": {
            "order": "XYZ",
            "radians": [0, 0, 0]
          },
          "scale": [1, 1, 1]
        },
        "editor": {
          "templateRole": "none"
        },
        "geometry": {
          "kind": "sphere",
          "parameters": {
            "radius": 0.45,
            "widthSegments": 25,
            "heightSegments": 11
          }
        },
        "material": {
          "type": "meshStandard",
          "color": "#C7B433",
          "roughness": 0.55,
          "metalness": 0.05,
          "opacity": 1,
          "transparent": false,
          "wireframe": false,
          "flatShading": false,
          "side": "front"
        }
      },
      {
        "id": "60000000-0000-4000-8000-000000000005",
        "type": "mesh",
        "name": "Performance Mesh 5",
        "parentId": null,
        "visible": true,
        "locked": false,
        "transform": {
          "position": [-6.875, 0.5, -5.625],
          "rotation": {
            "order": "XYZ",
            "radians": [0, 0, 0]
          },
          "scale": [1, 1, 1]
        },
        "editor": {
          "templateRole": "none"
        },
        "geometry": {
          "kind": "sphere",
          "parameters": {
            "radius": 0.45,
            "widthSegments": 25,
            "heightSegments": 11
          }
        },
        "material": {
          "type": "meshStandard",
          "color": "#33AEC7",
          "roughness": 0.55,
          "metalness": 0.05,
          "opacity": 1,
          "transparent": false,
          "wireframe": false,
          "flatShading": false,
          "side": "front"
        }
      },
      {
        "id": "60000000-0000-4000-8000-000000000006",
        "type": "mesh",
        "name": "Performance Mesh 6",
        "parentId": null,
        "visible": true,
        "locked": false,
        "transform": {
          "position": [-5.625, 0.5, -5.625],
          "rotation": {
            "order": "XYZ",
            "radians": [0, 0, 0]
          },
          "scale": [1, 1, 1]
        },
        "editor": {
          "templateRole": "none"
        },
        "geometry": {
          "kind": "sphere",
          "parameters": {
            "radius": 0.45,
            "widthSegments": 25,
            "heightSegments": 11
          }
        },
        "material": {
          "type": "meshStandard",
          "color": "#C73383",
          "roughness": 0.55,
          "metalness": 0.05,
          "opacity": 1,
          "transparent": false,
          "wireframe": false,
          "flatShading": false,
          "side": "front"
        }
      },
      {
        "id": "60000000-0000-4000-8000-000000000007",
        "type": "mesh",
        "name": "Performance Mesh 7",
        "parentId": null,
        "visible": true,
        "locked": false,
        "transform": {
          "position": [-4.375, 0.5, -5.625],
          "rotation": {
            "order": "XYZ",
            "radians": [0, 0, 0]
          },
          "scale": [1, 1, 1]
        },
        "editor": {
          "templateRole": "none"
        },
        "geometry": {
          "kind": "sphere",
          "parameters": {
            "radius": 0.45,
            "widthSegments": 25,
            "heightSegments": 11
          }
        },
        "material": {
          "type": "meshStandard",
          "color": "#58C733",
          "roughness": 0.55,
          "metalness": 0.05,
          "opacity": 1,
          "transparent": false,
          "wireframe": false,
          "flatShading": false,
          "side": "front"
        }
      },
      {
        "id": "60000000-0000-4000-8000-000000000008",
        "type": "mesh",
        "name": "Performance Mesh 8",
        "parentId": null,
        "visible": true,
        "locked": false,
        "transform": {
          "position": [-3.125, 0.5, -5.625],
          "rotation": {
            "order": "XYZ",
            "radians": [0, 0, 0]
          },
          "scale": [1, 1, 1]
        },
        "editor": {
          "templateRole": "none"
        },
        "geometry": {
          "kind": "sphere",
          "parameters": {
            "radius": 0.45,
            "widthSegments": 25,
            "heightSegments": 11
          }
        },
        "material": {
          "type": "meshStandard",
          "color": "#3933C7",
          "roughness": 0.55,
          "metalness": 0.05,
          "opacity": 1,
          "transparent": false,
          "wireframe": false,
          "flatShading": false,
          "side": "front"
        }
      },
      {
        "id": "60000000-0000-4000-8000-000000000009",
        "type": "mesh",
        "name": "Performance Mesh 9",
        "parentId": null,
        "visible": true,
        "locked": false,
        "transform": {
          "position": [-1.875, 0.5, -5.625],
          "rotation": {
            "order": "XYZ",
            "radians": [0, 0, 0]
          },
          "scale": [1, 1, 1]
        },
        "editor": {
          "templateRole": "none"
        },
        "geometry": {
          "kind": "sphere",
          "parameters": {
            "radius": 0.45,
            "widthSegments": 25,
            "heightSegments": 11
          }
        },
        "material": {
          "type": "meshStandard",
          "color": "#C76433",
          "roughness": 0.55,
          "metalness": 0.05,
          "opacity": 1,
          "transparent": false,
          "wireframe": false,
          "flatShading": false,
          "side": "front"
        }
      },
      {
        "id": "60000000-0000-4000-8000-000000000010",
        "type": "mesh",
        "name": "Performance Mesh 10",
        "parentId": null,
        "visible": true,
        "locked": false,
        "transform": {
          "position": [-0.625, 0.5, -5.625],
          "rotation": {
            "order": "XYZ",
            "radians": [0, 0, 0]
          },
          "scale": [1, 1, 1]
        },
        "editor": {
          "templateRole": "none"
        },
        "geometry": {
          "kind": "sphere",
          "parameters": {
            "radius": 0.45,
            "widthSegments": 25,
            "heightSegments": 11
          }
        },
        "material": {
          "type": "meshStandard",
          "color": "#33C790",
          "roughness": 0.55,
          "metalness": 0.05,
          "opacity": 1,
          "transparent": false,